Marca temporal,GRADO,ACIERTOS,NOTA,VALORA_MEDIA,VALORA1,VALORA2,VALORA3,VALORA4,DEMO,P1,R_P1,P2,R_P2,P3,R_P3,P4,R_P4,P5,R_P5,P6,R_P6,P7,APRENDIZAJE1,APRENDIZAJE2
5/4/2023 11:56:50,ISAM,4,6.67,5.50,4,3,2,2,GafasVR,D,Acierto,A,Fallo,D,Fallo,B,Acierto,A,Acierto,D,Acierto,"primero se hará una consulta al raíz del.com y este le contestará con diciendo que pregunte a google.com. luego el servidor preguntará a google.com y este le mandará la IP que buscaba y buscará horarios de la URJC.
Una vez salen los resultados de la busqueda, pincha en ww.urjc.es teniendo primero google que preguntar al raiz, este le contestará diciendo que pregunte al .es, una vez le pregunte este le contestará diciendo que pregunte a urjc.es y por último al preguntarle a él, este mandará al servidor inicial la IP de la página.","Bueno, la animación en esta ocasión no me ha servido de tanto en parte creo que es porque conocía más de lo que pensaba el protocolo, pero en otras ocasiones me ha sido bastante útil",
5/4/2023 11:56:57,ISAM,6,10.00,4.00,2,2,2,2,Diapositivas,D,Acierto,C,Acierto,B,Acierto,B,Acierto,A,Acierto,D,Acierto,"En el primer paso, desde el pc, pregunta al servidor si tuviera la respuesta en el cache, lo diría, pero si no, haría una pregunta al DNS sobre la IP (¿www.google.com?) de la cuál, recibiría una respuesta con la IP del DNS. Mostrándose tras ello en el pc del usuario.
En el segundo paso, en este, estando en el mismo servidor, no habría ninguna pregunta ya que estaría todo ello por lo que se buscaría dentro de su espacio la información.
En el tercer paso, entraría en la pagina, haciendo el mismo procedimiento que en el primer paso",,"si hubiera podido visualizar, hubiera sido mejor"
5/4/2023 12:13:19,ISAM,3,5.00,4.50,2,3,2,2,Animacion3D,C,Fallo,C,Acierto,A,Fallo,A,Fallo,A,Acierto,D,Acierto,"Primeramente, el pc1 (pc del usuario) manda un mensaje de solicitud DNS recursivo a su servidor DNS Movistar. Ahora el DNS Movistar manda un mensaje de solicitud DNS no recursivo a DNS del dominio raíz preguntando por la dirección www.google.com. Este le envía un mensaje de respuesta DNS no recursivo a Movistar mostrándo la dirección del DNS .com para que le pregunte a él. Ahora se envía una petición DNS no recursiva a DNS .com preguntando por www.google.com. Este le manda un mensaje DNS no recursivo de respuesta diciendo que le pregunte al DNS google.com. Finalmente Movistar le envía el mensaje DNS a google.com preguntando por la dirección www.google.com y este le reenvía una respuesta con su dirección IP para establecer una conexión TCP para poder navegar que Movistar envía a pc1.

Ahora se realiza la misma metodología pero ahora desde el DNS de google.com. Primero a la raiz, le devuelve la dirección de .es. Después a .es le envia al DNS urjc.es y ya establecen una conexión gracias a que le proporciona si dirección IP.",,Seguramente si pero como no lo he probado no lo puedo demostrar
